{
  "conditional_syntheses": [],
  "external_verification_status": "INSUFFICIENT_EXTERNAL_EVIDENCE",
  "majority_vote_used": false,
  "rival_readings": [],
  "source_readings": [],
  "synthesis_hash": "0000000000000000000000000000000000000000000000000000000000000000",
  "synthesis_version": "16X-AUDITABLE-NONLINEAR-SYNTHESIS-2.3",
  "unresolved_claims": []
}